rate,votes,location,rest_type,dish_liked,cuisines,approx_cost(for two people),menu_item
4.2/5,354,Banashankari,Casual Dining,"Sushi, Noodles, Wine, Khau Suey, Mocktails, Yakisoba, Spring Roll","Asian, Korean, Indonesian, Japanese, Chinese, Thai, Momos",800,"['Bok Choy and Tofu Dumpling [6 Pieces]', 'Chicken Gyoza [6 Pieces]', 'Kaka Age Sushi Roll', 'California Sushi Roll', 'Salmon Sake Maki Sushi Roll', 'Korean Wings Chicken', 'Wamama Special Fried Chicken', 'Wasabi Prawns', 'Gobi Manchurian', 'Chilli Paneer', 'Crispy Baby Corn', 'Crispy Honey Chilli Potato', 'Drums of Heaven', 'Veg Ball', 'Veg Thai Green Curry', 'Chicken Thai Red Curry', 'Veg Fried Rice', 'Veg Schezwan Fried Rice', 'Egg Fried Rice', 'Chicken Fried Rice', 'Chicken Schezwan Fried Rice', 'Nasi Goreng Fried Rice', 'Veg Hakka Noodles', 'Veg Chili Garlic Noodles', 'Chicken Hakka Noodles', 'Veg Kimchi Ramen', 'Veg Khow Suey', 'Chicken Kimchi Ramen', 'Chicken Khow Suey', 'Make Your Own Chicken Meal', 'Veg Meal in a Bowl', 'Veg Peanut Lamein', 'Veg Kimchi Ramen', 'Veg Thukpa', 'Veg Khow Suey', 'Veg Longanma Mein', 'Veg Yum Mama', 'Chicken Thukpa', 'Chicken Peanut Lamein', 'Chicken Kimchi Ramen', 'Chicken Khow Suey', 'Chicken Yum Mama', 'Chicken Longanma Mein', 'Chicken Laksa', 'Prawns Kimchi Ramen', 'Prawns Khow Suey', 'Prawns Peanut Lamein', 'Prawns Longanma Mein', 'Prawns Thukpa', 'Prawns Yum Mama', 'Non Veg Meal in a Bowl', 'Prawn Laksa', 'Make Your Own Veg Meal', 'Make Your Own Chicken Meal', 'Make Your Own Lamb Meal', 'Make Your Own Seafood Meal', 'Veg Combo Meal', 'Veg Hot and Sour Soup', 'Veg Sweet Corn Soup', 'Veg Tom Yum Soup', 'Veg Manchow Soup', 'Veg Wonton Soup', 'Veg Tom Kha Soup', 'Veg Mongolian Spicy Pumpkin Soup', 'Veg Clear Soup', 'Veg Pho Soup', 'Veg Hinjo Soup', 'Veg Khow Suey Soup', 'Chicken Hot and Sour Soup', 'Chicken Sweet Corn Soup', 'Chicken Tom Yum Soup', 'Chicken Manchow Soup', 'Chicken Wonton Soup', 'Chicken Tom Kha Soup', 'Chicken Mongolian Spicy Pumpkin Soup', 'Chicken Clear Soup', 'Chicken Pho Soup', 'Chicken Hinjo Soup', 'Chicken Khow Suey Soup', 'Seafood Hot and Sour Soup', 'Seafood Sweet Corn Soup', 'Seafood Tom Yum Soup', 'Seafood Manchow Soup', 'Seafood Wonton Soup', 'Seafood Tom Kha Soup', 'Seafood Mongolian Spicy Pumpkin Soup', 'Seafood Clear Soup', 'Seafood Pho Soup', 'Seafood Hinjo Soup', 'Seafood Khow Suey Soup', 'Prawns Hot and Sour Soup', 'Prawns Tom Kha Soup', 'Prawns Khow Suey Soup', 'Prawns Sweet Corn Soup', 'Prawns Tom Yum Soup', 'Prawns Hinjo Soup', 'Prawns Clear Soup', 'Prawns Mongolian Spicy Pumpkin Soup', 'Prawns Pho Soup', 'Som Tam Salad', 'Thai Peanut Salad', 'Gomaae Beans Salad', 'Crunchy Green with Ginger Soy Dressing Salad', 'Spicy Cucumber Salad', 'Woon Sen Gai Salad', 'Larb Gai Salad', 'Haw Sui Kai Salad', 'Rock Corn Tempura', 'Yasai Tempura', 'Hunan Crispy Veg', 'Crunchy Mix Veg', 'Veg Satay', 'Vegetable Spring Roll', 'Red Hot Szechuan Chicken', 'Tai Pai Chicken', 'Veg Grill', 'Chicken Grill', 'Karaage Chicken', 'Pattaya Chicken', 'Chengdu Style Chicken', 'Kung Pao Chicken', 'Korean Wings Chicken', 'Yakitori Chicken', 'Satay Chicken', 'Wamama Special Fried Chicken', 'Korean BBQ Wings', 'Fish Grill', 'Fried Fish', 'Schezwan Fish', 'Prawns Ebi Tempura', 'Wasabi Prawns', 'Isaan Prawns', 'Prawns Grill', 'Non Veg Yakitori', 'Gobi Manchurian', 'Mushroom Manchurian', 'Chilli Paneer', 'Crispy Baby Corn', 'Crispy Honey Chilli Potato', 'Schezwan Bhel', 'Cherry Cheese Pineapple', 'Peanut Exotica', 'Fiery Chilli Chicken', 'Drums of Heaven', 'Hong Kong Chicken', 'Black Pepper Chicken', 'Shandong Chicken', 'Hot Garlic Chicken', 'Whole Pepper Chicken', 'Basil Chilli Chicken', 'Sliced Fish in Choice of Sauce', 'Prawns in Choice of Sauce', 'Stir Fried Greens', 'Mixed Veg in Chilli Bean Sauce', 'Deep Fried Beans Sichuan Style', 'Veg Ball', 'Yasai Itami', 'Padh Pakh', 'Thai Basil Eggplant', 'Fried Vegetable Hoisin Sauce', 'Beans in Schezwan Style', 'Diced Chicken Sauce', 'Chicken in Black Bean Sauce', 'Chicken in Chilli Bean', 'Chicken in Schezwan', 'Chicken Katsu', 'Korean Chicken', 'Teriyaki Chicken', 'Pad Krapow', 'Sapo Chicken', 'Thai Steam Fish', 'Vietnamese Grill Fish', 'Sambal Ikan', 'Prawns in Choice of Sauce', 'Veg Thai Red Curry', 'Veg Thai Green Curry', 'Veg Panang Curry', 'Veg Mandala Curry', 'Veg Lat Man Kai Curry', 'Chicken Thai Red Curry', 'Chicken Thai Green Curry', 'Chicken Kari Ayam', 'Chicken Panang Curry', 'Chicken Mandala Curry', 'Chicken Lat Mai Kai Curry', 'Rendang Curry', 'Prawns Thai Red Curry', 'Prawns Thai Green Curry', 'Seafood Red Thai Curry', 'Seafood Green Thai Curry', 'Seafood Panang Curry', 'Seafood Mandala Curry', 'Seafood Lat Man Kai Curry', 'Veg Fried Rice', 'Veg Schezwan Fried Rice', 'Veg Chili Garlic Fried Rice', 'Veg Khao Pad Fried Rice', 'Veg Yakimeshi Fried Rice', 'Steamed Rice', 'Egg Fried Rice', 'Egg Schezwan Fried Rice', 'Egg Chili Garlic Fried Rice', 'Chicken Fried Rice', 'Chicken Schezwan Fried Rice', 'Chicken Chilli Garlic Fried Rice', 'Chicken Khao Pad Fried Rice', 'Chicken Yakimeshi Fried Rice', 'Nasi Goreng Fried Rice', 'Seafood Fried Rice', 'Seafood Schezwan Fried Rice', 'Seafood Chili Garlic Fried Rice', 'Seafood Khao Pad Fried Rice', 'Seafood Yakimeshi Fried Rice', 'Veg Hakka Noodles', 'Veg Schezwan Noodles', 'Veg Chili Garlic Noodles', 'Veg Hong Kong Noodles', 'Veg Singapore Noodles', 'Veg Char Kway Teow', 'Veg Yakisoba Noodles', 'Mee Goreng', 'Egg Hakka Noodles', 'Egg Schezwan Noodles', 'Egg Chili Garlic Noodles', 'Egg Hong Kong Noodles', 'Egg Singapore Noodles', 'Egg Char Kway Teow', 'Egg Yakisoba', 'Chicken Hakka Noodles', 'Chicken Schezwan Noodles', 'Chicken Chili Garlic Noodles', 'Chicken Hongkong Noodles', 'Chicken Singapure Noodles', 'Chicken Char Kway Teow', 'Chicken Yakisoba', 'Seafood Hakka Noodles', 'Seafood Schezwan Noodles', 'Seafood Chili Garlic Noodles', 'Seafood Hong Kong Noodles', 'Seafood Singapore Noodles', 'Seafood Char Kway Teow', 'Seafood Yakisoba', 'Bok Choy and Tofu Dumpling [6 Pieces]', 'Corn and Spinach Dumpling [6 Pieces]', 'Assorted Vegetable Dimsum Platter [8 Pieces]', 'Chicken Sui Mai [6 Pieces]', 'Chicken Spicy Poached Dumpling [6 Pieces]', 'Chicken Gyoza [6 Pieces]', 'Chicken and Scallion Dumpling [6 Pieces]', 'Prawns Sui Mai [6 Pieces]', 'Prawns Spicy Poached Dumpling [6 Pieces]', 'Prawns and Scallion Dumpling [6 Pieces]', 'Prawns Gyoza [6 Pieces]', 'Wamama Special Bao', 'Char Sui Bao', 'Kaka Age Sushi Roll', 'Kapa Maki Roll', 'California Sushi Roll', 'Spicy Maki Roll', 'Assorted Vegetable Sushi Platter [12 Pieces]', 'Chicken Teriyaki Sushi Roll', 'Prawns Sake Maki Sushi Roll', 'Salmon Sake Maki Sushi Roll', 'Crab Sake Maki Sushi Roll', 'Prawns Kanikama Maki Roll', 'Salamon Kanikama Maki Roll', 'Crab Kanikama Maki Roll', 'Prawns Smoked Salmon Maki Roll', 'Salmon Smoked Salmon Maki Roll', 'Crab Smoked Salmon Maki Roll', 'Non Veg Sake Maki Sushi', 'Prawn Assorted Seafood Sushi Platter [12 Pieces]', 'Mineral Water [1 litre]']"
4.1/5,775,Banashankari,Casual Dining,"Pasta, Lunch Buffet, Masala Papad, Paneer Lajawab, Tomato Shorba, Dum Biryani, Sweet Corn Soup","North Indian, Mughlai, Chinese",800,[]
4.2/5,2115,Banashankari,Casual Dining,"Pizza, Pasta, Garlic Bread, Nachos, Penne Alfredo, Mozzarella Sticks, Salad","Pizza, Italian, Continental, Desserts",800,[]
3.8/5,977,Banashankari,Lounge,"Beer, Chicken Wings, Chilli Chicken, Onion Rings, Fries",Finger Food,"1,300",[]
4.1/5,868,Banashankari,Pub,"Beer, Wedges, Pizza, Nachos, Salads, Papaya Salad, Buffalo Wings","Continental, Italian, Mexican, North Indian, Chinese, Steak","1,200",[]
4.0/5,324,Banashankari,Cafe,"Pizza, Mocktails, Coffee, Nachos, Salad, Pasta, Sandwiches","Cafe, Italian, Continental",700,"['That Paneer Lover Pizza', 'Original Margarita Pizza', 'Chicago Lover Pizza', 'Art of Salsa Pizza', 'Super Spicy Peri Peri Pizza', 'Garden Fresh Fried Rice', 'Mixed Fried Rice', 'Green Garden', 'Wings Galore', 'Broccoli and Almond Soup', 'Creamy Mushroom Soup', 'Veg Minestrone Soup', 'Veg Noodle Soup', 'Veg Hot and Sour Soup', 'Veg Sweet Corn Soup', 'Chicken Sweet Corn Soup', 'Chicken Hot and Sour Soup', 'Smoked Chicken Salad', 'Lettuce O Holic Salad', 'Caesar Salad', 'Paprika', 'Cajun Fries', 'Jalapeno Heat Garlic Bread', 'Garlic Bread', 'Pesto Cheese Garlic Bread', 'Veg Nachos Cheese Salsa', 'Potato Wedges', 'Cheese Stuffed Mushroom', 'Cheese Balls', 'BBQ Chicken Wings', 'Crispy Fish Fingers', 'Chicken Nuggets', 'Peri Peri Chicken Wings', 'Garlicky Chicken', 'Chicken Swiss Stock', 'Pan Fried Fish', 'Veg Steak', 'Chicken Steak', 'Fish Steak', 'Chilly Crispy Veg', 'Mushroom Chilly', 'Paneer Chilly', 'Mushroom Manchurian', 'Egg Masala Lover', 'Deviled Egg', 'Maharajah Omelette', 'Spinach and Corn Feta Omelette', 'Egg White Fretteda', 'Egg Chilly', 'Chicken Lollipop', 'Chilly Chicken', 'Chicken Manchurian', 'Chicken Schezwan', 'Grilled Veg', 'Stuffed Mushroom Chicken', 'Basa Fish Roll', 'Veg Schezwan Fried Rice', 'Veg Shangai Fried Rice', 'Veg Schezwan Noodles Fried Rice', 'Veg Burnt Garlic Noodles Fried Rice', 'Egg Burnt Garlic Noodles Fried Rice', 'Egg Schezwan Noodles Fried Rice', 'Egg Shangai Fried Rice', 'Egg Schezwan Fried Rice', 'Chicken Burnt Garlic Noodles Fried Rice', 'Chicken Shangai Fried Rice', 'Chicken Schezwan Noodles Fried Rice', 'Chicken Schezwan Fried Rice', 'Seafood Schezwan Noodles Fried Rice', 'Seafood Burnt Garlic Noodles Fried Rice', 'Seafood Schezwan Fried Rice', 'Seafood Shangai Fried Rice', 'That Paneer Lover Pizza', 'Nachos Pizza', 'Garlic Nachos Pizza', 'Original Margarita Pizza', 'Garden Fresh Pizza', 'Chicago Lover Pizza', 'Desi Masala Tadka Pizza', 'Art of Salsa Pizza', 'Mint Madness Pizza', 'Mint O Holic Pizza', 'Green Thumb Pizza', 'Pesto King Pizza', 'Bulls Eye Pizza', 'Sunny Side Mint Pizza', 'Meat Eater Salasa Zombie Pizza', 'Triple P Peri Peri Pizza', 'Roasted and Pesto Ed Pizza', 'Super Spicy Peri Peri Pizza', 'Kentucky Killing Pizza', 'Calafornication Pizza', 'Veg Pasta', 'Non Veg Pasta', 'Spinach and Corn Sandwich', 'Grilled Vegetable Sandwich', 'BBQ Chicken Sandwich', 'Peri Peri Chicken Sandwich', 'Jalapeno Cottage Cheese Burger', 'Classic Cutlet Burger', 'BBQ Chicken Burger', 'Chicken Classic Burger', 'Fish Fillet Burger', 'Classic Brownie', 'Peach Iced Tea', 'Indian Summer', 'Virgin Mojito', 'Paan Mojito', 'Cumin Lemonade', 'White Angel', 'Blushing Dragon', 'Fruit Punch', 'Lychee Punch', 'Strawberry Lemonade', 'Cappuccino', 'Latte', 'Espresso', 'Desi Special Coffee', 'Saffron Magic', 'Popcorn Latte', 'Mocha Latte', 'Salted Caramel Latte', 'Hot Chocolate', 'Red Velvet Latte', 'Turmeric Latte', 'Herbal Highness', 'Mexican Hot Chocolate Chai', 'Green Chai', 'Masala Chai', 'Ginger Chai', 'Vietnamese Cold Coffee Shake', 'On The Rocks Shake', 'Salted Caramel Shake', 'Brownie Shake', 'Popcorn Iced Latte Shake', 'Chovolate Shake', 'Rasmalai Rumble Shake', 'Oreo Shake', 'Red Velvet Love Shake', 'Strawberry Shake', 'Nutela Shake']"
4.1/5,787,Banashankari,Casual Dining,"Momos, Lunch Buffet, Chocolate Nirvana, Thai Green Curry, Paneer Tikka, Dum Biryani, Chicken Biryani","Chinese, North Indian, Thai",800,[]
4.2/5,504,Banashankari,Cafe,"Waffles, Pasta, Coleslaw Sandwich, Choco Waffle, Tacos, Momos, Cheese Nachos","Cafe, Mexican, Italian, Momos, Beverages",550,"['Cheesy Fries', 'Loaded Fries', 'Fiery Fries', 'Chilli Cheese Fries', 'Loaded Nachos', 'Arrabiatta Pasta', 'Mixed Sauce Pasta', 'Creamy Alfredo Pasta', 'Steamed Veg [7 Pcs]', 'Panner Wraps', 'Original Fries', 'Cheesy Fries', 'Loaded Fries', 'Fiery Fries', 'Schezwan Wala Fries', 'Chilli Cheese Fries', 'American Barbeque Fries', 'Desi Fries', 'Mexicana Fries', 'Smoked and Spicy Fries', 'Green Fries', 'Tex Mex Nachos', 'Relish Nachos', 'Fiery Nachos', 'Loaded Nachos', 'Cheesy Nachos', 'Fusion Nachos', 'Hot and Cheesy Quesadilla', 'Potatoes Quesadilla', 'Veggie Quesadillas', 'Bean Stalk', 'Po Tacos', 'Cottage cheese', 'Pesto Pasta', 'Arrabiatta Pasta', 'Mixed Sauce Pasta', 'Creamy Alfredo Pasta', 'Peri Peri Meal', 'Green and Cheese Meal', 'Desi Schezwan Meal', 'Indo Mex', 'Fried Paneer [7 Pcs]', 'Fried Veg [7 Pcs]', 'Steamed Paneer [7 Pcs]', 'Steamed Veg [7 Pcs]', 'Corn Cap Twisty', 'Veg Twisty', 'Go Potatoes', 'Exotic Veg Twisty', 'Cheese Surprise Twisty', 'Panner Wraps', 'Good Old Coleslaw', 'Mint Sandwich', 'Pesto Sandwich', 'Tandoori Panner Sandwich', 'Cheese Jalapeno', 'Bbq Panner', 'Creamy Corn', 'Spicy Coleslaw', 'Veg Burst', 'Schezwan Corn Cheese', 'Classic Waffle', 'Choco Melt Waffle', 'Mouth Full Of Berry', 'Banana La Na Waffle', 'Chocolate Overload Waffle', 'Banana Twist Waffle', 'Mango Vanilla Waffle', 'Honey Dew', 'Pretty Berry', 'Mango Yum Yum', 'Watermelon Cool', 'Green Apple', 'Fresh As A Flower', 'Passion Fashion', 'Mojo Jojo', 'Peach Beach', 'Cranberry Cooler', 'Irish Coffee', 'Paan Ras Wala', 'Banana Caramel', 'Classic Roucher', 'Red Velvet', 'Brownie Point', 'Thank you Berry Much', 'Berry Bombastic', 'Hazelnut Coffee', 'Oreo Love', 'Shake King', 'Nutty Professor', 'Sweet Bomb', 'Mango Colada', 'Golden Shake', 'Pa Paan', 'Double Decker', 'Cocoa Oreo', 'Pinacolada', 'Coffee Crazee', 'Kids Surprise', 'Mr. Brown', 'Fruit Blast', 'Dynamite', 'Kido Land', 'Nut Delight', 'Ferrero Ricious', 'Coffee Mischief', 'Kitty Kat', 'Peanut Cluster', 'Cookie Cobbler', 'Brownie Kaapi', 'Snicker Flicker', 'Nuts Overload', 'Caramel Nuts', 'Brownie Bling', 'Mango Maniac', 'Lychee Flirt', 'Banana Gulkand', 'Very Berry', 'Strawberry Queen', 'Miss Fancy Red', 'Banana Nutella', 'Lychee Mango', 'Choco Almond', 'Cookie Crunch']"
4.1/5,402,Banashankari,Cafe,"Waffles, Pasta, Crispy Chicken, Honey Chilli Chicken, Sandwich, Coffee, Crepe",Cafe,500,"['Nutella Crepe', 'Waffles with Nutella', 'Veg Pizza', 'Veg Penne Arrabiata Pasta', 'Ravioli Mushroom Pasta', 'Masala Maggi', ""Hulk's Own Chicken Burger"", 'Fresh Veggie Sandwich', 'Chicken Sandwich', 'French Fries', 'Chicken Nuggets', 'French Fries', 'Honey Chilli Potato', 'Bruschetta', 'Potato Wedges', 'Onion Pakoda', 'Aloo Pakoda', 'Crispy Baby Corn', 'Veg Nuggets', 'French Toast', 'Mushroom Crepe', 'Honey Chilli Chicken', 'Chicken Nuggets', 'Chicken Cheese Nuggets', 'Golden Fried Chicken', 'Crispy Fried Chicken', 'Sausage with Fried Eggs', 'Barbecue Chicken Sausage', 'Hot Garlic Chicken', 'Veg Pizza', 'Chicken Pizza', 'Chicken Sausage Pizza', 'Veg Penne Alfredo Pasta', 'Veg Spaghetti Alfredo Pasta', 'Veg Penne Arrabiata Pasta', 'Veg Spaghetti Arrabiata Pasta', 'Veg Lasagna Bolognese Pasta', 'Ravioli Mushroom Pasta', 'Chicken Penne Alfredo Pasta', 'Chicken Spaghetti Alfredo Pasta', 'Chicken Penne Arrabiata Pasta', 'Chicken Spaghetti Arrabiata Pasta', 'Chicken Lasagna Bolonese Pasta', 'Veg Burger', 'Chicken Burger', ""Hulk's Own Chicken Burger"", 'Potato Sandwich', 'Chilli Cheese Sandwich', 'Green Sandwich', 'Fresh Veggie Sandwich', 'Tomato Cheese Sandwich', 'Schezwan Veg Sandwich', 'Egg Sandwich', 'Schezwan Chicken Sandwich', 'Chicken Sandwich', 'Masala Maggi', 'Veg Maggi', 'Chilli Maggi', 'Egg Maggi', 'Chicken Maggi', 'Chicken Hot Dog', 'Cheese Omelette', 'Mushroom Omelette', 'Masala Omelette', 'Nutella Crepe', 'Waffles with Honey', 'Waffles with Maple Syrup', 'Waffles with Chocolate Sauce', 'Waffles with Nutella', 'Cappuccino', 'Cafe Latte', 'Irish Coffee', 'Cafe Mocha', 'Espresso', 'Black Coffee', 'Chococcino', 'Irish Latte', 'Filter Coffee', 'Cafe Frappe', 'Choco Frappe', 'Coffee on the Rocks', 'Mocha Chillo', 'Coffee Crush', 'Devils Own Coffee', 'Green Tea', 'Peppermint Tea', 'Lemon Tea', 'Assam Tea', 'Sulaimani Tea', 'Masala Chai', 'Ghar ki Chai', 'Lemon Iced Tea', 'Peach Iced Tea', 'Fresh Mint Iced Tea', 'Strawberry Iced Tea', 'Litchi Iced Tea', 'Almond Smoothie', 'Vanilla Smoothie', 'Blackcurrant Smoothie', 'Mango Smoothie', 'Litchi Smoothie', 'Strawberry Smoothie', 'Strawberry Soda', 'Lime Soda', 'Triple Sec Soda', 'Cool Blue Granita', 'Choco Rocks', 'Brownie Shake', 'Oreo Shake']"
4.2/5,150,Banashankari,Cafe,"Mocktails, Peri Fries, Lasagne, Pizza, Chicken Bbq Wings, Virgin Mojito, Nachos","Cafe, Italian, Continental",600,"['Chicken Steak', 'Veg Fried Rice', 'Schezwan Veg Noodles', 'Chicken Noodles', 'Paneer 65', 'Chicken Chilly Coriander', 'Crispy Corn', 'Tomato Basil Soup', 'Veg Minestrone Soup', 'Cream of Mushroom Soup', 'Chicken Minestrone Soup', 'Cream of Chicken Soup', 'Veg Greek Salad', 'Veg Ceasar Salad', 'Veg Mexican Salad', 'Veg Russian Salad', 'Chicken Greek Salad', 'Chicken Ceasar Salad', 'Chicken Mexican Salad', 'Chicken Russian Salad', 'Gobi Manchurian', 'Gobi Chilly', 'Mushroom Chilly', 'Paneer 65', 'Paneer Chilly', 'Honey Chilly Potato', 'Egg Chilly', 'Egg Manchurian', 'Chicken Chilly Coriander', 'Fish Chilly Coriander', 'Chilly Fish', 'Plain French Fries', 'Masala French Fries', 'Crispy Corn', 'Bruschetta', 'Plain Garlic Bread', 'Cheese Garlic Bread', 'Pizza Sticks', 'Nachos', 'Chicken Wings', 'Fish Fingers', 'Veg Thai Green Curry', 'Veg Thai Red Curry', 'Veg Lasagna', 'Peri Peri Paneer', 'Mexican Cottage Chesse', 'Chicken Thai Green Curry', 'Chicken Thai Red Curry', 'Chicken Lasagna', 'Peri Peri Chicken', 'Chicken Steak', 'Grilled Fish in Lemon Butter Sauce', 'Chicken Stroganoff', 'Grilled Fish in Lemon Butter Sauce', 'Fish and Chips', 'Veg Alfredo Pasta', 'Veg Arrabiata Pasta', 'Veg Burnt Garlic Pasta', 'Veg Spaghetti Agli-e-Olio', 'Veg Basil Pesto Pasta', 'Non Veg Basil Pesto Pasta', 'Non Veg Spaghetti Agli-e-Olio', 'Non Veg Alfredo Pasta', 'Non Veg Arrabiata Pasta', 'Non Veg Burnt Garlic Pasta', 'Margherita Pizza', 'Farmhouse Pizza', 'Veg Basil Pesto Pizza', ""Chef's Inhouse Paneer Pizza"", ""Chef's Inhouse Chicken Pizza"", 'Non Veg Basil Pesto Pizza', 'Chicken Tikka Pizza', 'Veg Fried Rice', 'Schezwan Fried Rice', 'American Fried Rice', 'Chicken Fried Rice', 'Schezwan Chicken Fried Rice', 'American Chicken Fried Rice', 'Veg Noodles', 'American Noodles Veg', 'Schezwan Veg Noodles', 'Chicken Noodles', 'Schezwan Chicken Noodles', 'American Chicken Noodles', 'Veg Burger', 'Paneer Burger', 'Chicken Burger', 'Peri Peri Chicken Burger', 'Mixed Veg Wrap', 'Paneer Tikka Wrap', 'Egg and Cheese Wrap', 'Chicken Tikka Wrap']"
4.2/5,164,Banashankari,Cafe,"Coffee, Spaghetti, Pancakes, Nachos, Pasta, Sandwich, Garlic Bread","Cafe, Chinese, Continental, Italian",500,"['Egg Boiled', 'Egg Omelette', 'Egg Scrambled', 'Sunny Side Up Egg', 'Egg White Only', 'French Toast', 'Crepe', 'Pan Cakes', 'Tomato Soup', 'Cream Of Chicken Soup', 'Classic Garlic Bread', 'Cheese Garlic Bread', 'Veg Cheese Corn Balls', 'Cheese Chilli Garlic Bread', 'Veg Loaded Potato Skins', 'Veg Olive Hummus And Flat Bread', 'Veg Nachos', 'Jalapeno Cheese Balls', 'Paneer Poppers', 'Plain Chicken Wings', 'Spicy Chicken Loaded Potato Skin', 'Barbeque Chicken Wings', 'Chicken Finger', 'Red Hot Chicken Wings', 'Non Veg Nachos', 'Chicken Popcorn', 'Fish Fingers', 'Mac And Cheese Pasta', 'Farmers Pie', 'Paneer Skewers', 'Veg Tajine', 'Caribbean Veg Curry With Fragrant Rice', 'Veg Lasagne', 'Chicken Skewer Rice Bowl', 'Chicken Cordon Bleu', 'Chicken Lasagne', 'Chicken Parmigiana', 'Portuguese Coriander Chicken', 'Fish And Chips', 'Salisbury Chicken Steak', 'Masala Veg Maggie', 'Masala Cheese Maggie', 'Veg Arrabiata Pasta', 'Veg Aglio E Olio Pasta', 'Veg Alfredo Pasta', 'Veg Creamy Tomato Pasta', 'Veg Pesto Pasta', 'Egg Maggie', 'Barbeque Chicken Sausage Maggie', 'Chicken Maggie', 'Chicken Arrabiata Pasta', 'Chicken Aglio E Olio Pasta', 'Chicken Alfredo Pasta', 'Chicken Creamy Tomato Pasta', 'Chicken Pesto Pasta', 'Aloo Burger', 'Mexican Bean Burger', 'Falafel Burger', 'Breakfast Burger', 'Crispy Chicken Burger', 'Smokey Chicken Burger', 'Cheese Chicken Burger', 'Veg Club Sandwich', 'Cheese Spinach And Corn Sub', 'Veg Fajita Sub', 'Pesto Vegetables Sub', 'Crispy Baby Corn Sub', 'Masala Paneer Sub', 'Omelette Sandwich', 'Tandoori Chicken Sandwich', 'Chicken Salami Sub', 'Fajita Sub', 'Chicken Club Sandwich', 'Louisiana Hot Dog', 'Mushroom Corn And Cheese Crepe', 'Spinach And Paneer Crepe', 'Peri Peri Chicken Crepe', 'Pesto Chicken Crepe', 'Tandoori Chicken Crepe', 'Virgin Mojito', 'Butterscotch Milkshake', 'Cold Coffee Mojito', 'Green Apple Mojito', 'Choco Oreo Milkshake', 'Cold Coffee Milkshake', 'Mango Milkshake', 'Mixed Berry Milkshake', 'Strawberry Milkshake', 'Lemon Ice Tea', 'Passion Fruit Mojito', 'Peach Ice Tea', 'Nutella Banana Shake', 'Nutella Chocolate Shake', 'Protein Shake']"
4.2/5,244,Banashankari,Casual Dining,"Pasta, Pepper Pizza, Paneer Pizza, Peppy Paneer, Nachos, Supreme Pizza, Manchow Soup","Italian, North Indian, Mexican",800,[]
4.0/5,771,Banashankari,Casual Dining,"Panner Tikka, Kulfi, Coffee, Pav Bhaji, Carrot Halwa, Fried Rice, Set Dosa","South Indian, North Indian, Chinese",450,"['Vada', 'Ghee Masala Dosa', 'Onion Dosa', 'Rava Dosa', 'Open Butter Masala', 'Gobi Manchurian', 'Baby Corn Manchurian', 'Panner Manchurian', 'Mushroom Manchurian', 'Veg Noodles', 'Veg Fried Rice', 'Panner Fried Rice', 'Mushroom Fried Rice', 'Panner Tikka', 'Roti', 'Butter Naan', 'Palak Paneer [Serves 2]', 'Paneer Butter Masala [Serves 2]', 'Paneer Kadai [Serves 2]', 'Mushroom Masala [Serves 2]', 'Dal Tadka [Serves 2]', 'Gud Bud Special', 'Panner Malia Tikka', 'Panner Tikka', 'Panner Peshwari Tikka', 'Palak Paneer [Serves 2]', 'Aloo Palak [Serves 2]', 'Palak Gobi [Serves 2]', 'Dal Palak [Serves 2]', 'Corn Palak [Serves 2]', 'Peas Palak [Serves 2]', 'Palak Milan [Serves 2]', 'Baby Corn Masala [Serves 2]', 'Capsicum Masala [Serves 2]', 'Corn Capsicum Masala [Serves 2]', 'Mix Veg Curry [Serves 2]', 'Veg Kurma [Serves 2]', 'Veg Kolapuri [Serves 2]', 'Veg Jaipuri [Serves 2]', 'Veg Hydrabadi [Serves 2]', 'Veg Patiala [Serves 2]', 'Veg Kadai [Serves 2]', 'Veg Do Pyaza [Serves 2]', 'Veg Keema [Serves 2]', 'Veg Mily Chilli [Serves 2]', 'Veg Shahi Kurma [Serves 2]', 'Veg Lajawab [Serves 2]', 'Paneer Kaju Masala [Serves 2]', 'Kaju Masala [Serves 2]', 'Kaju Mutter [Serves 2]', 'Baby Corn Paneer Butter Masala [Serves 2]', 'Paneer Butter Masala [Serves 2]', 'Paneer Kurma [Serves 2]', 'Paneer Pasanda [Serves 2]', 'Paneer Kolhapuri [Serves 2]', 'Paneer Hydrabadi [Serves 2]', 'Paneer Pepper Masala [Serves 2]', 'Khoya Paneer [Serves 2]', 'Paneer Shahi Kurma [Serves 2]', 'Paneer Patiala [Serves 2]', 'Shahi Paneer [Serves 2]', 'Paneer Lajawab [Serves 2]', 'Paneer Kadai [Serves 2]', 'Mushroom Masala [Serves 2]', 'Baby Corn Mushroom Masala [Serves 2]', 'Mushroom Kadai [Serves 2]', 'Aloo Gobi Masala [Serves 2]', 'Aloo Matar [Serves 2]', 'Channa Masala [Serves 2]', 'Dal Fry [Serves 2]', 'Dal Tadka [Serves 2]', 'Dal Makhani [Serves 2]', 'Dal Punjabi [Serves 2]', 'Nargis Kofta [Serves 2]', 'Malai Kofta [Serves 2]', 'Maharani Kofta [Serves 2]', 'Methi Special Kofta [Serves 2]', 'Paneer Kofta [Serves 2]', 'Roti', 'Butter Roti', 'Kulcha', 'Butter Kulcha', 'Naan', 'Butter Naan', 'Methi Roti', 'Pudina Kulcha', 'Masala Kulcha', 'Stuffed Naan', 'Veg Noodles', 'Veg Fried Rice', 'Panner Fried Rice', 'Mushroom Fried Rice', 'Ghee Masala Dosa', 'Ghee Plain Dosa', '2 Set Dosa', 'Onion Dosa', 'Rava Dosa', 'Open Butter Masala', '2 Akki Roti', 'Gobi Manchurian', 'Baby Corn Manchurian', 'Panner Manchurian', 'Mushroom Manchurian', '2 Idly', 'Vada', 'Rava Idly', 'Kesari Bhath', 'Khara Bhath', 'Chow Chow Bhath', '2 Poori', 'Dahi Vada', 'Rice Bhath', 'Bun', 'Coffee', 'Tea', 'Badam Milk', 'Butterscotch Ice Cream [1 Scoop]', 'Pista Ice Cream [1 Scoop]', 'Mango Ice Cream [1 Scoop]', 'Strawberry Ice Cream [1 Scoop]', 'Chocolate Ice Cream [1 Scoop]', 'Vanilla Ice Cream [1 Scoop]', 'Blackcurrant Ice Cream [1 Scoop]', 'Arabian Fantasy Ice Cream [1 Scoop]', 'Fruit Punch Ice Cream [1 Scoop]', 'Gud Bud Special', 'Chocolate Sundae', 'Golden Cherry', 'Double Sundae', 'Hot Chocolate Fudge', 'Royal Falooda', 'Kesar Falooda', 'Gulab Jamun', 'Carrot Halwa', 'Kashi Halwa', 'Mosambi Juice', 'Grape Juice', 'Pineapple Juice', 'Watermelon Juice', 'Muskmelon Juice', 'Pudina Lime Juice', 'Apple Milkshake', 'Chikoo Milkshake', 'Ice Cream Milkshake']"
4.2/5,1647,Banashankari,Casual Dining,"Noodles, Momos, Veg Manchow Soup, Kung Pao Chicken, Chicken Lollipop, Chop Suey, Dragon Chicken","Chinese, Thai, Momos",600,[]
4.0/5,808,Banashankari,Casual Dining,"Salads, Panneer Butter Masala, Rabri, Gajar Ka Halwa, Manchow Soup, Aam Panna, Tomato Basil Soup","North Indian, Chinese",850,[]
4.0/5,424,Banashankari,Cafe,"Sandwich, Omelette, Ice Tea, Virgin Mojito, Hot Chocolate, Pasta Arrabiata, Hazelnut Cappuccino","Cafe, Continental",450,[]
